{
  "$schema": "https://json-schema.org/draft/2020-12/schema",
  "$id": "urn:ki-live-voice-agents:schema:tenant-live-voice-profile:0.3.0",
  "title": "KI Live Voice Agents Tenant Profile",
  "type": "object",
  "additionalProperties": false,
  "required": [
    "contract_version",
    "tenant_id",
    "studio_slug",
    "display_name",
    "status",
    "default_locale",
    "hostnames",
    "public_widget",
    "live_voice_agents",
    "policy_bundle",
    "validators"
  ],
  "properties": {
    "contract_version": { "$ref": "#/$defs/semver" },
    "tenant_id": { "$ref": "#/$defs/id" },
    "studio_slug": { "$ref": "#/$defs/id" },
    "display_name": { "type": "string", "minLength": 1 },
    "status": { "type": "string", "enum": ["setup", "active", "disabled", "archived"] },
    "default_locale": { "type": "string", "pattern": "^[a-z]{2}-[A-Z]{2}$" },
    "hostnames": {
      "type": "array",
      "items": { "$ref": "#/$defs/hostnameRecord" },
      "minItems": 1,
      "uniqueItems": true
    },
    "public_widget": { "$ref": "#/$defs/publicWidget" },
    "live_voice_agents": {
      "type": "array",
      "items": { "$ref": "#/$defs/liveVoiceAgent" },
      "minItems": 1,
      "uniqueItems": true
    },
    "assistant_agents": {
      "type": "array",
      "items": { "$ref": "#/$defs/assistantAgent" },
      "uniqueItems": true
    },
    "phone_agents": {
      "type": "array",
      "items": { "$ref": "#/$defs/phoneAgent" },
      "uniqueItems": true,
      "default": []
    },
    "upload_policy": { "$ref": "#/$defs/uploadPolicy" },
    "knowledge": { "$ref": "#/$defs/scopeConfig" },
    "data_sources": {
      "type": "array",
      "items": { "$ref": "#/$defs/dataSource" },
      "uniqueItems": true
    },
    "policy_bundle": { "$ref": "#/$defs/idArray" },
    "validators": { "$ref": "#/$defs/idArray" }
  },
  "$defs": {
    "id": { "type": "string", "pattern": "^[a-z][a-z0-9-]*$" },
    "semver": { "type": "string", "pattern": "^[0-9]+\\.[0-9]+\\.[0-9]+$" },
    "idArray": {
      "type": "array",
      "items": { "$ref": "#/$defs/id" },
      "uniqueItems": true
    },
    "hostnameRecord": {
      "type": "object",
      "additionalProperties": false,
      "required": ["hostname", "purpose", "expected_origin"],
      "properties": {
        "hostname": { "type": "string", "minLength": 1 },
        "purpose": { "type": "string", "enum": ["website", "widget", "api"] },
        "expected_origin": { "type": "string", "minLength": 1 }
      }
    },
    "publicWidget": {
      "type": "object",
      "additionalProperties": false,
      "required": [
        "agent_name",
        "agent_subtitle",
        "welcome_message",
        "privacy_url",
        "retention_days",
        "voice_enabled",
        "upload_enabled",
        "contact_form_enabled"
      ],
      "properties": {
        "agent_name": { "type": "string", "minLength": 1 },
        "agent_subtitle": { "type": "string", "minLength": 1 },
        "welcome_message": { "type": "string", "minLength": 1 },
        "privacy_url": { "type": "string", "minLength": 1 },
        "retention_days": { "type": "integer", "minimum": 1 },
        "voice_enabled": { "type": "boolean" },
        "upload_enabled": { "type": "boolean" },
        "contact_form_enabled": { "type": "boolean" }
      }
    },
    "liveVoiceAgent": {
      "type": "object",
      "additionalProperties": false,
      "required": [
        "id",
        "agent_type",
        "display_name",
        "prompt_profile",
        "enabled",
        "model",
        "voice",
        "skills",
        "tools",
        "knowledge_scopes",
        "data_scopes",
        "policies",
        "validators"
      ],
      "properties": {
        "id": { "$ref": "#/$defs/id" },
        "agent_type": { "type": "string", "const": "live-voice" },
        "display_name": { "type": "string", "minLength": 1 },
        "prompt_profile": { "$ref": "#/$defs/id" },
        "enabled": { "type": "boolean" },
        "model": { "type": "string", "minLength": 1 },
        "voice": { "type": "string", "minLength": 1 },
        "skills": { "$ref": "#/$defs/idArray" },
        "tools": { "$ref": "#/$defs/idArray" },
        "knowledge_scopes": { "$ref": "#/$defs/idArray" },
        "data_scopes": { "$ref": "#/$defs/idArray" },
        "policies": { "$ref": "#/$defs/idArray" },
        "validators": { "$ref": "#/$defs/idArray" },
        "audience": {
          "type": "string",
          "enum": ["public", "internal-authenticated"],
          "default": "public"
        },
        "contact_handoff": {
          "type": "object",
          "additionalProperties": false,
          "required": [
            "secure_form_required",
            "voice_pii_collection_allowed",
            "crm_target",
            "contact_endpoint",
            "usage_endpoint"
          ],
          "properties": {
            "secure_form_required": { "type": "boolean", "const": true },
            "voice_pii_collection_allowed": { "type": "boolean", "const": false },
            "crm_target": { "$ref": "#/$defs/id" },
            "contact_endpoint": { "type": "string", "minLength": 1 },
            "usage_endpoint": { "type": "string", "minLength": 1 }
          }
        }
      }
    },
    "phoneAgent": {
      "type": "object",
      "additionalProperties": false,
      "required": ["id", "display_name", "prompt_profile", "adapter", "model", "voice", "greeting"],
      "properties": {
        "id": { "$ref": "#/$defs/id" },
        "agent_type": { "const": "phone-assistant", "default": "phone-assistant" },
        "display_name": { "type": "string", "minLength": 1 },
        "prompt_profile": { "$ref": "#/$defs/id" },
        "enabled": { "type": "boolean", "default": false },
        "adapter": { "const": "fritzbox-sip" },
        "model": { "type": "string", "minLength": 1 },
        "voice": { "type": "string", "minLength": 1 },
        "greeting": { "type": "string", "minLength": 1 },
        "max_call_seconds": { "type": "integer", "minimum": 30, "maximum": 1800, "default": 600 },
        "knowledge_scopes": { "type": "array", "items": { "type": "string" }, "default": [] },
        "tools": {
          "type": "array",
          "items": { "type": "string", "enum": ["submit_phone_contact_handoff"] },
          "uniqueItems": true,
          "default": []
        },
        "data_scopes": { "$ref": "#/$defs/idArray" },
        "policies": { "$ref": "#/$defs/idArray" },
        "validators": { "$ref": "#/$defs/idArray" },
        "contact_handoff": {
          "type": "object",
          "additionalProperties": false,
          "required": [
            "secure_form_required",
            "voice_pii_collection_allowed",
            "crm_target",
            "contact_endpoint",
            "usage_endpoint"
          ],
          "properties": {
            "secure_form_required": { "type": "boolean", "const": false },
            "voice_pii_collection_allowed": { "type": "boolean", "const": true },
            "crm_target": { "$ref": "#/$defs/id" },
            "contact_endpoint": { "type": "string", "minLength": 1 },
            "usage_endpoint": { "type": "string", "minLength": 1 }
          }
        },
        "store_audio": { "const": false, "default": false },
        "store_transcript": { "const": false, "default": false }
      }
    },
    "assistantAgent": {
      "type": "object",
      "additionalProperties": false,
      "required": [
        "id",
        "agent_type",
        "display_name",
        "prompt_profile",
        "enabled",
        "provider",
        "model_env",
        "allowed_surfaces",
        "allowed_modes",
        "tools",
        "knowledge_scopes",
        "policies",
        "validators"
      ],
      "properties": {
        "id": { "$ref": "#/$defs/id" },
        "agent_type": { "type": "string", "const": "text-assistant" },
        "display_name": { "type": "string", "minLength": 1 },
        "prompt_profile": { "$ref": "#/$defs/id" },
        "enabled": { "type": "boolean" },
        "provider": { "type": "string", "const": "openai-compatible-local" },
        "model_env": { "type": "string", "const": "LIQUISTO_ASSISTANT_LLM_MODEL" },
        "allowed_surfaces": {
          "type": "array",
          "items": { "type": "string", "enum": ["cockpit", "crm", "trade", "control"] },
          "minItems": 1,
          "uniqueItems": true
        },
        "allowed_modes": {
          "type": "array",
          "items": { "type": "string", "const": "inform-and-prepare" },
          "minItems": 1,
          "uniqueItems": true
        },
        "tools": { "type": "array", "maxItems": 0 },
        "knowledge_scopes": { "$ref": "#/$defs/idArray" },
        "policies": { "$ref": "#/$defs/idArray" },
        "validators": { "$ref": "#/$defs/idArray" }
      }
    },
    "uploadPolicy": {
      "type": "object",
      "additionalProperties": false,
      "required": ["enabled", "ai_analysis_allowed", "allowed_content_types"],
      "properties": {
        "enabled": { "type": "boolean" },
        "ai_analysis_allowed": { "type": "boolean" },
        "allowed_content_types": {
          "type": "array",
          "items": { "type": "string", "minLength": 1 },
          "minItems": 1,
          "uniqueItems": true
        }
      }
    },
    "scopeConfig": {
      "type": "object",
      "additionalProperties": false,
      "required": ["scope_id", "indexes"],
      "properties": {
        "scope_id": { "$ref": "#/$defs/id" },
        "indexes": { "$ref": "#/$defs/idArray" }
      }
    },
    "dataSource": {
      "type": "object",
      "additionalProperties": false,
      "required": ["id", "tenant_id", "type", "display_name", "access_modes", "status", "sensitivity", "system", "required_permission", "allowed_classifications"],
      "properties": {
        "id": { "$ref": "#/$defs/id" },
        "tenant_id": { "$ref": "#/$defs/id" },
        "type": { "type": "string", "enum": ["website", "database", "upload_storage", "other"] },
        "display_name": { "type": "string", "minLength": 1 },
        "access_modes": {
          "type": "array",
          "items": { "type": "string", "enum": ["read", "write"] },
          "minItems": 1,
          "uniqueItems": true
        },
        "status": { "type": "string", "enum": ["planned", "active", "disabled", "archived"] },
        "sensitivity": { "type": "string", "enum": ["public", "internal", "confidential", "restricted"] },
        "system": { "$ref": "#/$defs/id" },
        "required_permission": { "type": "string", "pattern": "^[a-z][a-z0-9-]*:read$" },
        "allowed_classifications": {
          "type": "array",
          "items": { "type": "string", "enum": ["public", "internal"] },
          "minItems": 1,
          "uniqueItems": true
        }
      }
    }
  }
}
