{
  "contract_version": "0.2.0",
  "tenant_id": "liquisto",
  "studio_slug": "liquisto",
  "display_name": "Liquisto",
  "status": "active",
  "default_locale": "de-DE",
  "hostnames": [
    {
      "hostname": "liquisto.cloud",
      "purpose": "website",
      "expected_origin": "https://liquisto.cloud"
    },
    {
      "hostname": "widget.liquisto.cloud",
      "purpose": "widget",
      "expected_origin": "https://widget.liquisto.cloud"
    },
    {
      "hostname": "api.liquisto.cloud",
      "purpose": "api",
      "expected_origin": "https://api.liquisto.cloud"
    }
  ],
  "public_widget": {
    "agent_name": "Olivia de Jong",
    "agent_subtitle": "Interne KI-Assistentin",
    "welcome_message": "Hallo, ich bin Olivia de Jong, die interne digitale KI-Assistentin von Liquisto.com. Wobei kann ich unterstuetzen?",
    "privacy_url": "/datenschutz",
    "retention_days": 90,
    "voice_enabled": false,
    "upload_enabled": false,
    "contact_form_enabled": false
  },
  "live_voice_agents": [
    {
      "id": "liquisto-assistant",
      "agent_type": "live-voice",
      "display_name": "Olivia de Jong",
      "prompt_profile": "liquisto-assistant",
      "enabled": true,
      "model": "gpt-realtime-2.1",
      "voice": "shimmer",
      "skills": [],
      "tools": [
        "open_liquisto_destination"
      ],
      "knowledge_scopes": [
        "liquisto-runtime-knowledge"
      ],
      "data_scopes": [
        "principal-scoped-context-read"
      ],
      "policies": [
        "strict-tenant-isolation",
        "no-cross-tenant-access",
        "internal-authentication-required",
        "principal-permission-filtering-required",
        "read-only",
        "draft-only",
        "navigation-only",
        "provider-sideband-attestation-required",
        "browser-navigation-input-not-authority",
        "idempotent-single-use-completion-required",
        "no-free-url",
        "no-browser-automation",
        "no-mutation",
        "no-contact-handoff",
        "no-raw-audio-storage"
      ],
      "validators": [
        "tenant-profile-validator",
        "internal-principal-validator",
        "source-authorization-validator",
        "assistant-contract-validator",
        "navigation-intent-contract-validator",
        "navigation-runtime-attestation-validator",
        "navigation-completion-replay-validator"
      ],
      "audience": "internal-authenticated"
    }
  ],
  "assistant_agents": [
    {
      "id": "liquisto-assistant",
      "agent_type": "text-assistant",
      "display_name": "Olivia de Jong",
      "prompt_profile": "liquisto-assistant",
      "enabled": true,
      "provider": "openai-compatible-local",
      "model_env": "LIQUISTO_ASSISTANT_LLM_MODEL",
      "allowed_surfaces": [
        "cockpit",
        "crm",
        "trade",
        "control"
      ],
      "allowed_modes": [
        "inform-and-prepare"
      ],
      "tools": [],
      "knowledge_scopes": [
        "liquisto-runtime-knowledge",
        "request-bounded-context"
      ],
      "policies": [
        "strict-tenant-isolation",
        "principal-permission-filtering-required",
        "read-only",
        "draft-only",
        "no-execution",
        "no-external-web",
        "no-runtime-tools",
        "no-context-snapshot-persistence"
      ],
      "validators": [
        "service-token-validator",
        "local-provider-url-validator",
        "bounded-context-validator",
        "source-authorization-validator",
        "assistant-contract-validator"
      ]
    }
  ],
  "upload_policy": {
    "enabled": false,
    "ai_analysis_allowed": false,
    "allowed_content_types": [
      "application/pdf",
      "image/jpeg",
      "image/png"
    ]
  },
  "knowledge": {
    "scope_id": "liquisto-runtime-knowledge",
    "indexes": [
      "liquisto-knowledge-chunks"
    ]
  },
  "data_sources": [
    {
      "id": "liquisto-business-purpose",
      "tenant_id": "liquisto",
      "type": "website",
      "display_name": "Liquisto Business Purpose",
      "access_modes": ["read"],
      "status": "active",
      "sensitivity": "public",
      "system": "liquisto-tenant-registry",
      "required_permission": "tenant:read",
      "allowed_classifications": ["public"]
    },
    {
      "id": "crm-companies",
      "tenant_id": "liquisto",
      "type": "database",
      "display_name": "CRM Companies",
      "access_modes": ["read"],
      "status": "active",
      "sensitivity": "internal",
      "system": "liquisto-crm",
      "required_permission": "crm:read",
      "allowed_classifications": ["internal"]
    },
    {
      "id": "crm-deals",
      "tenant_id": "liquisto",
      "type": "database",
      "display_name": "CRM Deals",
      "access_modes": ["read"],
      "status": "active",
      "sensitivity": "internal",
      "system": "liquisto-crm",
      "required_permission": "crm:read",
      "allowed_classifications": ["internal"]
    },
    {
      "id": "crm-open-tasks",
      "tenant_id": "liquisto",
      "type": "database",
      "display_name": "CRM Open Tasks",
      "access_modes": ["read"],
      "status": "active",
      "sensitivity": "internal",
      "system": "liquisto-crm",
      "required_permission": "crm:read",
      "allowed_classifications": ["internal"]
    },
    {
      "id": "liquisto-cloud-architecture",
      "tenant_id": "liquisto",
      "type": "other",
      "display_name": "liquisto.cloud Architecture",
      "access_modes": ["read"],
      "status": "planned",
      "sensitivity": "internal",
      "system": "liquisto-architecture",
      "required_permission": "architecture:read",
      "allowed_classifications": ["internal"]
    },
    {
      "id": "liquisto-platform-content",
      "tenant_id": "liquisto",
      "type": "other",
      "display_name": "Liquisto Platform Content",
      "access_modes": ["read"],
      "status": "planned",
      "sensitivity": "internal",
      "system": "liquisto-platform",
      "required_permission": "content:read",
      "allowed_classifications": ["internal"]
    },
    {
      "id": "liquisto-internal-processes",
      "tenant_id": "liquisto",
      "type": "other",
      "display_name": "Liquisto Internal Processes",
      "access_modes": ["read"],
      "status": "planned",
      "sensitivity": "internal",
      "system": "liquisto-processes",
      "required_permission": "processes:read",
      "allowed_classifications": ["internal"]
    },
    {
      "id": "liquisto-website",
      "tenant_id": "liquisto",
      "type": "website",
      "display_name": "Liquisto Website",
      "access_modes": ["read"],
      "status": "planned",
      "sensitivity": "public",
      "system": "liquisto-website",
      "required_permission": "website:read",
      "allowed_classifications": ["public"]
    },
    {
      "id": "liquisto-trade",
      "tenant_id": "liquisto",
      "type": "database",
      "display_name": "Liquisto Trade",
      "access_modes": ["read"],
      "status": "planned",
      "sensitivity": "confidential",
      "system": "liquisto-trade",
      "required_permission": "trade:read",
      "allowed_classifications": ["internal"]
    },
    {
      "id": "liquisto-control",
      "tenant_id": "liquisto",
      "type": "database",
      "display_name": "Liquisto Control",
      "access_modes": ["read"],
      "status": "planned",
      "sensitivity": "confidential",
      "system": "liquisto-control",
      "required_permission": "control:read",
      "allowed_classifications": ["internal"]
    },
    {
      "id": "liquisto-documents",
      "tenant_id": "liquisto",
      "type": "other",
      "display_name": "Liquisto Documents",
      "access_modes": ["read"],
      "status": "planned",
      "sensitivity": "confidential",
      "system": "liquisto-documents",
      "required_permission": "documents:read",
      "allowed_classifications": ["internal"]
    },
    {
      "id": "liquisto-integrations",
      "tenant_id": "liquisto",
      "type": "other",
      "display_name": "Liquisto Integrations",
      "access_modes": ["read"],
      "status": "planned",
      "sensitivity": "confidential",
      "system": "liquisto-integrations",
      "required_permission": "integrations:read",
      "allowed_classifications": ["internal"]
    }
  ],
  "policy_bundle": [
    "strict-tenant-isolation",
    "no-cross-tenant-access",
    "fail-closed-unknown-scope",
    "principal-permission-filtering-required",
    "read-only",
    "draft-only",
    "navigation-only",
    "provider-sideband-attestation-required",
    "browser-navigation-input-not-authority",
    "idempotent-single-use-completion-required",
    "no-business-mutation",
    "no-free-url",
    "no-browser-automation",
    "no-contact-handoff",
    "no-raw-audio-storage"
  ],
  "validators": [
    "tenant-profile-validator",
    "internal-principal-validator",
    "source-authorization-validator",
    "assistant-contract-validator",
    "navigation-intent-contract-validator",
    "navigation-runtime-attestation-validator",
    "navigation-completion-replay-validator"
  ]
}
